product_name,brand,price,source_file
Carrefour Sugo alla Amatriciana 350 g,Carrefour,"3,69",CONDIMENTI_CONSERVE
Polli In Cucina! Olive Verdi e Nere a Rondelle 2 x 40 g,Polli,"22,38",CONDIMENTI_CONSERVE
Monini Classico Olio Extra Vergine di Oliva 1 L,Monini,"11,40",CONDIMENTI_CONSERVE
Agromonte Passata Siciliana con Datterino 520 g,Agromonte,"3,37",CONDIMENTI_CONSERVE
Heinz Classic Barbecue 260 g,Heinz,"11,73",CONDIMENTI_CONSERVE
Rio mare Tonno all'Olio Extra Vergine di Oliva Leggero 4 x 60 g,Rio mare,"24,54",CONDIMENTI_CONSERVE
Gemma di mare Gli Integrali Sale Marino del Mediterraneo Grosso 1000 g,Gemma di mare,"0,89",CONDIMENTI_CONSERVE
Asdomar Filetti di Tonno al naturale in Acqua di Mare di Sardegna 150 g,Asdomar,"46,57",CONDIMENTI_CONSERVE
Polli In Cucina! Olive Verdi Denocciolate 2 x 40 g,Polli,"22,38",CONDIMENTI_CONSERVE
Carrefour Classic Pomodori Pelati in Succo di Pomodoro 3 x 400 g,Carrefour,"2,37",CONDIMENTI_CONSERVE
Asdomar Filetti di Tonno all'olio di oliva 150 g,Asdomar,"35,27",CONDIMENTI_CONSERVE
Carrefour Bio Passata rustica 700 g,Carrefour Bio,"2,13",CONDIMENTI_CONSERVE
Giovanni Rana il Sugo Fresco alla Bolognese 225 g,Giovanni Rana,"14,18",CONDIMENTI_CONSERVE
Carrefour Classic Polpa di Pomodoro in Succo di Pomodoro per Pizza 400 g,Carrefour,"1,63",CONDIMENTI_CONSERVE
Rio mare Filetti di Sgombro all'Olio Extra Vergine di Oliva Grigliati 120 g,Rio mare,"24,92",CONDIMENTI_CONSERVE
Star il mio Dado Classico 20 Dadi 200 g,Star,"12,95",CONDIMENTI_CONSERVE
Due Vittorie Aceto Balsamico di Modena IGP 250 ml,Due Vittorie,"41,20",CONDIMENTI_CONSERVE
Carrefour Classic Pomodori Pelati in Succo di Pomodoro 400 g,Carrefour,"2,68",CONDIMENTI_CONSERVE
Knorr Cuore di Brodo Vegetale 4 x 28 g,Knorr,"17,77",CONDIMENTI_CONSERVE
Carrefour Classic Polpa Fine di Pomodoro in Succo di Pomodoro 3 x 400 g,Carrefour,"2,08",CONDIMENTI_CONSERVE
Carrefour Classic Olio di Semi di Arachide 1 L,Carrefour,"3,59",CONDIMENTI_CONSERVE
Star il mio Brodo di Carne Mista 1000 ml,Star,"2,29",CONDIMENTI_CONSERVE
Rio mare Filetti di Sgombro al Naturale Grigliati 120 g,Rio mare,"24,92",CONDIMENTI_CONSERVE
Sasso Olio Sasso Olio di Oliva 1 L,Sasso,"10,50",CONDIMENTI_CONSERVE
Star il mio Brodo di Verdure 1000 ml,Star,"2,29",CONDIMENTI_CONSERVE
Carrefour Bio Aceto di Mele 500 ml,Carrefour Bio,"3,38",CONDIMENTI_CONSERVE
Mareblu Leggero 3 x 60 g,Mareblu,"19,39",CONDIMENTI_CONSERVE
Giovanni Rana il Pesto Fresco Pomodori Secchi e Pecorino 140 g,Giovanni Rana,"19,21",CONDIMENTI_CONSERVE
Rio mare Tonno all'Olio di Oliva 8 x 80 g,Rio mare,"17,64",CONDIMENTI_CONSERVE
Carrefour Classic Cetriolini 360 g,Carrefour,"9,17",CONDIMENTI_CONSERVE
Carrefour Classic Olive Nere Snocciolate 2 x 50 g,Carrefour,"10,90",CONDIMENTI_CONSERVE
Giovanni Rana il Sugo Fresco al Parmigiano Reggiano 150 g,Giovanni Rana,"22,33",CONDIMENTI_CONSERVE
Carrefour Classic Sugo al Basilico 350 g,Carrefour,"2,71",CONDIMENTI_CONSERVE
Olio Extravergine di Oliva 100% Italiano Uliveto al Sole - 750 ml,Dante,"10,65",CONDIMENTI_CONSERVE
Costa d'Oro l'Extra Olio Extra Vergine di Oliva 1 L,Costa d'Oro,"9,80",CONDIMENTI_CONSERVE
Carrefour Piselli Fini 410 g,Carrefour,"4,41",CONDIMENTI_CONSERVE
Bertolli Olio di Oliva 1 L,Bertolli,"9,89",CONDIMENTI_CONSERVE
Rio mare Pesto al Tonno con Pistacchi e Limone 130 g,Rio mare,"23,77",CONDIMENTI_CONSERVE
Valfrutta Borlotti italiani 3 x 400 g,Valfrutta,"4,33",CONDIMENTI_CONSERVE
Carrefour Bio Mais dolce 2 x 160 g,Carrefour Bio,"8,75",CONDIMENTI_CONSERVE
Carrefour Classic Capperi in Aceto di Vino 210 g,Carrefour,"17,18",CONDIMENTI_CONSERVE
Delicius Filetti di Sgombro al naturale 90 g,Delicius,"39,85",CONDIMENTI_CONSERVE
Valfrutta Ceci Italiani 3 x 400 g,Valfrutta,"4,79",CONDIMENTI_CONSERVE
Barilla Pesto Basilico e Rucola Condimento e Sugo per Pasta 190 g,Barilla,"14,16",CONDIMENTI_CONSERVE
Carrefour Classic Ketchup 280 g,Carrefour,"3,89",CONDIMENTI_CONSERVE
Calvé Barbecue 250 ml,Calvé,"10,36",CONDIMENTI_CONSERVE
il Pesto di Pra' Pesto senza aglio 90 g,il Pesto di Pra',"40,56",CONDIMENTI_CONSERVE
Asdomar Filetto di Salmone all'olio di oliva 150 g,Asdomar,"30,60",CONDIMENTI_CONSERVE
Polli Pesto alla Genovese Senza Aglio 2 x 90 g,Polli,"19,39",CONDIMENTI_CONSERVE
Pesto di Pistacchio 190 g,Sicilia Perfetta,"23,25",CONDIMENTI_CONSERVE
Carrefour Classic Sugo alla Arrabbiata 350 g,Carrefour,"2,71",CONDIMENTI_CONSERVE
Terre d'Italia Filetti di acciughe di Sicilia in olio extra vergine di oliva 90 g,Terre d'Italia,"41,67",CONDIMENTI_CONSERVE
"Carrefour Salmone all'Olio di Oliva 23,8% al Gusto Affumicato 190 g",Carrefour,"19,42",CONDIMENTI_CONSERVE
Simpl Fagiolini Finissimi 800 g,Simpl,"2,84",CONDIMENTI_CONSERVE
Mutti Passata Mutti di pomodoro al basilico 700 g,Mutti,"2,07",CONDIMENTI_CONSERVE
Giovanni Rana il Pesto Fresco Noci 140 g,Giovanni Rana,"19,21",CONDIMENTI_CONSERVE
Carrefour Classic Pesto Verde Basilico Fresco 190 g,Carrefour,"7,32",CONDIMENTI_CONSERVE
Heinz Maionese Originale 460 g,Heinz,"7,72",CONDIMENTI_CONSERVE
Asdomar Tonno Trancio intero all'olio di oliva	 80 g x 2 + 1,Asdomar,"21,25",CONDIMENTI_CONSERVE
Cuore olio di mais 110 cl,Cuore,"5,99",CONDIMENTI_CONSERVE
Carrefour Classic Polpa di Pomodoro in Succo di Pomodoro 3 x 400 g,Carrefour,"1,58",CONDIMENTI_CONSERVE
Valfrutta Cotti a Vapore Cannellini 3 x 150 g,Valfrutta,"6,40",CONDIMENTI_CONSERVE
Carrefour Sugo alla Carne 350 g,Carrefour,"3,69",CONDIMENTI_CONSERVE
Mutti Polpa Datterini in Pezzi 3 x 300 g,Mutti,"3,88",CONDIMENTI_CONSERVE
Tigullio Gran Pesto alla Genovese 190 g,Tigullio,"13,95",CONDIMENTI_CONSERVE
Star il mio Brodo di Manzo 500 ml,Star,"2,98",CONDIMENTI_CONSERVE
Mutti Passata Mutti di pomodoro 560 g,Mutti,"2,93",CONDIMENTI_CONSERVE
Carrefour Classic Polpa di Pomodoro in Succo di Pomodoro 400 g,Carrefour,"1,63",CONDIMENTI_CONSERVE
Bonduelle Fagioli Rossi al Vapore 3 x 160 g,Bonduelle,"7,07",CONDIMENTI_CONSERVE
Mutti Pomodorini Datterini 2 x 220 g,Mutti,"8,90",CONDIMENTI_CONSERVE
Asdomar Tonno all'olio di oliva 3 x 80 g,Asdomar,"18,71",CONDIMENTI_CONSERVE
Carrefour Fagioli Borlotti 3 x 200 g,Carrefour,"5,31",CONDIMENTI_CONSERVE
Carrefour Classic Polpa di Pomodoro in Succo di Pomodoro  680 g,Carrefour,"1,99",CONDIMENTI_CONSERVE
Clemente le Masserie del Parco Olio Extra Vergine di Oliva 100% Italiano 1 L,Clemente,"11,10",CONDIMENTI_CONSERVE
Terre d'Italia Filetti di acciughe di Sicilia in olio extra vergine di oliva 156 g,Terre d'Italia,"38,40",CONDIMENTI_CONSERVE
"Rio mare Insalatissime Insalata di Tonno Cous Cous con ceci, piselli e pomodorini 220 g",Rio mare,"19,50",CONDIMENTI_CONSERVE
Giglio Oro Olio di Semi di Girasole 1 L,Giglio Oro,"4,29",CONDIMENTI_CONSERVE
Rio mare Filetti di Tonno Lavorati a Mano all'Olio di Oliva 250 g,Rio mare,"31,96",CONDIMENTI_CONSERVE
Biffi Che Sugo! Sugo al Pomodoro e Basilico 200 g,Biffi,"8,75",CONDIMENTI_CONSERVE
Bonduelle Taccole Tagliate 400 g,Bonduelle,"6,89",CONDIMENTI_CONSERVE
Bonduelle Piselli Finissimi 3 x 160 g,Bonduelle,"7,26",CONDIMENTI_CONSERVE
Carrefour Extra Salmone al naturale 190 g,Carrefour,"29,52",CONDIMENTI_CONSERVE
Saclà OlivOlì Snocciolate 290 g,Saclà,"20,75",CONDIMENTI_CONSERVE
Carrefour Bio Sugo alle verdure 350 g,Carrefour Bio,"4,14",CONDIMENTI_CONSERVE
Carrefour Bio Fagioli di soia Edamame 200 g,Carrefour Bio,"17,31",CONDIMENTI_CONSERVE
Dante Classico Olio di Oliva 1 L,Dante,"9,89",CONDIMENTI_CONSERVE
"Bonduelle Ratatouille con Melanzane, Zucchine e Peperoni 375 g",Bonduelle,"8,13",CONDIMENTI_CONSERVE
Carrefour Bio Succo di limoni biologici di Sicilia 25 cl,Carrefour Bio,"7,56",CONDIMENTI_CONSERVE
Carrefour Tonno a Pinne Gialle all'Olio di Oliva pescato a canna 3 x 80 g,Carrefour,"15,38",CONDIMENTI_CONSERVE
il Pesto di Pra' Pesto Genovese 90 g,il Pesto di Pra',"40,56",CONDIMENTI_CONSERVE
Carrefour Bio Sugo al basilico 350 g,Carrefour Bio,"4,14",CONDIMENTI_CONSERVE
Giglio Oro Olio di Semi di Arachide 1 L,Giglio Oro,"4,79",CONDIMENTI_CONSERVE
Star il mio Dado Classico 30 Dadi 300 g,Star,"11,97",CONDIMENTI_CONSERVE
Rio mare Tonno all'Olio di Oliva 4 x 120 g,Rio mare,"17,06",CONDIMENTI_CONSERVE
Giovanni Rana il Sugo Fresco Cacio e Pepe 150 g,Giovanni Rana,"22,33",CONDIMENTI_CONSERVE
Carrefour Olive Verdi Snocciolate in salamoia 680 g,Carrefour,"10,28",CONDIMENTI_CONSERVE
Terre d'Italia Ragù alla bolognese 180 g,Terre d'Italia,"20,50",CONDIMENTI_CONSERVE
Tigullio Gran Pesto alla Genovese Senz'Aglio 190 g,Tigullio,"13,95",CONDIMENTI_CONSERVE
Mareblu Tonno all'Olio d'Oliva 4 x 60 g,Mareblu,"21,25",CONDIMENTI_CONSERVE
"Zaffy Zafferano 2 x 0,13 g",Zaffy,"8.653,85",CONDIMENTI_CONSERVE
Carrefour Extra Olive Farcite 300 g,Carrefour,"9,17",CONDIMENTI_CONSERVE
Bauer Vegetale Bio Dadi per insaporire i tuoi piatti 6 x 10 g,Bauer,"43,17",CONDIMENTI_CONSERVE
Biffi Che Sugo! Pesto Senza Aglio D.O.P. 90 g,Biffi,"19,44",CONDIMENTI_CONSERVE
Star il mio Gran Ragù Piccante con Peperoncino 2 x 180 g,Star,"8,03",CONDIMENTI_CONSERVE
Calvè Classica 225 ml,Calvé,"10,44",CONDIMENTI_CONSERVE
Saclà Acetelli Cetrioli 290 g,Saclà,"11,00",CONDIMENTI_CONSERVE
Star il mio Brodo di Pollo 1000 ml,Star,"2,29",CONDIMENTI_CONSERVE
Terre d'Italia Salsa alla norma 290 g,Terre d'Italia,"9,97",CONDIMENTI_CONSERVE
Carapelli il Frantolio Olio Extra Vergine di Oliva 1 L,Carapelli,"10,60",CONDIMENTI_CONSERVE
Carrefour Bio Olio extra vergine di oliva Mediterraneo 750 ml,Carrefour Bio,"10,92",CONDIMENTI_CONSERVE
Knorr Dado Vegetale 20 Dadi 200 g,Knorr,"10,45",CONDIMENTI_CONSERVE
Kraft mayonnaise 142 g,Kraft,"9,67",CONDIMENTI_CONSERVE
Cirio i Classici dal 1856 Polpa Finissima 2 x 210 g,Cirio,"3,31",CONDIMENTI_CONSERVE
Giovanni Rana il Sugo Fresco Funghi 180 g,Giovanni Rana,"17,72",CONDIMENTI_CONSERVE
Mareblu VeroNaturale Tonno al Naturale 4 x 60 g,Mareblu,"17,04",CONDIMENTI_CONSERVE
Star il mio Dado Vegetale -30% Sale# 10 Dadi 100 g,Star,"14,50",CONDIMENTI_CONSERVE
Valfrutta Cotti a Vapore Piselli Piccoli Italiani 3 x 150 g,Valfrutta,"6,40",CONDIMENTI_CONSERVE
Rio mare Filetti di Sgombro dell'Atlantico all'Olio di Oliva 125 g,Rio mare,"18,00",CONDIMENTI_CONSERVE
Calvé Salsa Tonnata 225 ml,Calvé,"13,29",CONDIMENTI_CONSERVE
Carrefour Sensation Cannellini all'Uccelletto 400 g,Carrefour,"4,73",CONDIMENTI_CONSERVE
Mutti le Verdurine Salsina di Pomodoro e Verdurine 130 g,Mutti,"9,92",CONDIMENTI_CONSERVE
Bertolli Olio Extra Vergine di Oliva Gentile 1 L,Bertolli,"10,50",CONDIMENTI_CONSERVE
Carrefour Classic Vongole Sgusciate al Naturale 130 g,Carrefour,"25,38",CONDIMENTI_CONSERVE
Carrefour Piselli Medi 3 x 410 g,Carrefour,"3,94",CONDIMENTI_CONSERVE
Giovanni Rana il Ragù Vegetale BologNew! 180 g,Giovanni Rana,"17,72",CONDIMENTI_CONSERVE
Saclà OlivOlì Nere Snocciolate 330 g,Saclà,"11,27",CONDIMENTI_CONSERVE
Rio mare Tonno all'Olio Extra Vergine di Oliva 4 x 80 g,Rio mare,"16,53",CONDIMENTI_CONSERVE
"Bonduelle Mais Mix Mais, Olive e Peperoni 3 x 170 g",Bonduelle,"5,35",CONDIMENTI_CONSERVE
Gemma di mare Gli Integrali Sale Marino del Mediterraneo Fino 1000 g,Gemma di mare,"0,89",CONDIMENTI_CONSERVE
Knorr Brodo Granulare Vegetale 150 g,Knorr,"13,93",CONDIMENTI_CONSERVE
Rio mare Tonno all'Olio di Oliva 2 x 240 g,Rio mare,"15,94",CONDIMENTI_CONSERVE
Terre d'Italia Olive verdi in salamoia cultivar Bella di Cerignola 530 g,Terre d'Italia,"9,65",CONDIMENTI_CONSERVE
"Rio mare Insalatissime Insalata di Tonno Piccantina con riso, fagioli e olio piccante 220 g",Rio mare,"19,50",CONDIMENTI_CONSERVE
Lupini salati 150 g,Madama Oliva,"6,67",CONDIMENTI_CONSERVE
Barilla Sugo Amatriciana Condimento per Pasta 400g,Barilla,"7,48",CONDIMENTI_CONSERVE
Rio mare Insalatissime Insalata di Tonno 5 Cereali con grano saraceno e olive verdi 220 g,Rio mare,"19,50",CONDIMENTI_CONSERVE
Simmenthal 3 x 70 g,Simmenthal,"16,90",CONDIMENTI_CONSERVE
Tigullio Peperoni e Noci 185 g,Tigullio,"14,32",CONDIMENTI_CONSERVE
Monini Classico Premi e Spremi Olio Extra Vergine di Oliva 450 ml,Monini,"13,22",CONDIMENTI_CONSERVE
Star il mio Brodo di Carne Mista 500 ml,Star,"2,98",CONDIMENTI_CONSERVE
Terre d'Italia Pomodoro San Marzano dell'Agro Sarnese Nocerino DOP 400 g,Terre d'Italia,"5,73",CONDIMENTI_CONSERVE
"3 Cuochi Zafferano 4 x 0,15 g",3 Cuochi,"9.250,00",CONDIMENTI_CONSERVE
Heinz Tomato Ketchup 250 g,Heinz,"5,96",CONDIMENTI_CONSERVE
Carrefour Classic Pomodorini in Succo di Pomodoro 400 g,Carrefour,"3,71",CONDIMENTI_CONSERVE
Carrefour Bio Maionese 180 g,Carrefour Bio,"11,94",CONDIMENTI_CONSERVE
Heinz Maionese Originale 395 g,Heinz,"9,49",CONDIMENTI_CONSERVE
Simpl Olio di semi di girasole per Friggere 1 L,Simpl,"1,99",CONDIMENTI_CONSERVE
Carrefour Classic Olio di Semi di Mais 1 L,Carrefour,"2,59",CONDIMENTI_CONSERVE
Tigullio Pomodori Secchi e Pistacchi 185 g,Tigullio,"14,32",CONDIMENTI_CONSERVE
Saclà OlivOlì Nere Toste 100 g,Saclà,"9,90",CONDIMENTI_CONSERVE
Cirio Passata Verace 540 g,Cirio,"2,87",CONDIMENTI_CONSERVE
Rizzoli Filetti di Alici in olio di oliva 58 g,Rizzoli,"53,28",CONDIMENTI_CONSERVE
Knorr Saporito Manzo 10 Dadi 100 g,Knorr,"12,50",CONDIMENTI_CONSERVE
Carrefour Bio Aceto Balsamico di Modena IGP 250 ml,Carrefour Bio,"11,56",CONDIMENTI_CONSERVE
Heinz Salsa Curry Mango 225 g,Heinz,"15,78",CONDIMENTI_CONSERVE
Barilla Pesto Genovese Vegan Condimento e Sugo per Pasta 195 g,Barilla,"13,79",CONDIMENTI_CONSERVE
Simpl Polpa di Pomodoro in Succo di Pomodoro 3 x 400 g,Simpl,"1,74",CONDIMENTI_CONSERVE
"Zafferano del Contadino 4 Bustine 0,50 g",Contadino,"7.900,00",CONDIMENTI_CONSERVE
Asdomar Filetto di Salmone al naturale 150 g,Asdomar,"46,90",CONDIMENTI_CONSERVE
Rio mare Filetto di Salmone al Naturale al Vapore 125 g,Rio mare,"50,80",CONDIMENTI_CONSERVE
Star il mio Dado Vegetale 20 Dadi 200 g,Star,"12,95",CONDIMENTI_CONSERVE
Calvé Burger 250 ml,Calvé,"10,36",CONDIMENTI_CONSERVE
Rio mare Pesto al Tonno con Olive Nere e Peperoncino 130 g,Rio mare,"23,77",CONDIMENTI_CONSERVE
Rio mare Tonno all'Olio di Oliva con Peperoncino di Calabria 4 x 80 g,Rio mare,"16,53",CONDIMENTI_CONSERVE
Barilla Salsa Pronta Datterini 100% ingredienti italiani 300g,Barilla,"5,30",CONDIMENTI_CONSERVE
Calvé Salsa Rosa 250 ml,Calvé,"10,36",CONDIMENTI_CONSERVE
Carrefour Classic Capperi in Aceto di Vino 100 g,Carrefour,"27,80",CONDIMENTI_CONSERVE
Carrefour Ketchup 6 x 12 g,Carrefour,"74,17",CONDIMENTI_CONSERVE
Terre d'Italia Passata di pomodoro di Puglia 500 g,Terre d'Italia,"2,98",CONDIMENTI_CONSERVE
Terre d'Italia Caponata di melanzane di Sicilia 300 g,Terre d'Italia,"8,83",CONDIMENTI_CONSERVE
Carrefour Classic Filetti di Alici Distesi in Olio di Oliva 46 g,Carrefour,"35,33",CONDIMENTI_CONSERVE
"Carapelli Delizia Olio Extra Vergine di Oliva 0,75 L",Carapelli,"11,32",CONDIMENTI_CONSERVE
Barilla Sugo Ragù Contadino vino rosso Condimento per Pasta 400g,Barilla,"7,48",CONDIMENTI_CONSERVE
Olive Verdi Aperitivo 150 gr.,Olive Lucarelli,"6,67",CONDIMENTI_CONSERVE
Asdomar Filetti di Tonno all'olio di oliva 250 g,Asdomar,"32,76",CONDIMENTI_CONSERVE
Star Il Mio Gran Ragù con Salsiccia 2 x 180 g,Star,"8,03",CONDIMENTI_CONSERVE
Carrefour Bio Piselli 2 x 160 g,Carrefour Bio,"7,82",CONDIMENTI_CONSERVE
Tigullio Radicchio e Speck 185 g,Tigullio,"14,32",CONDIMENTI_CONSERVE
Carrefour Tonno all'Olio di Oliva 2 x 160 g,Carrefour,"13,09",CONDIMENTI_CONSERVE
"Tigullio Ricotta, Tartufo e Pepe Nero 185 g",Tigullio,"14,32",CONDIMENTI_CONSERVE
Carrefour Tonno pinne gialle all'olio extra vergine di oliva 2 x 80 g,Carrefour,"16,56",CONDIMENTI_CONSERVE
Rizzoli Filetti di Tonno in Olio di Oliva 200 g,Rizzoli,"26,45",CONDIMENTI_CONSERVE
Carrefour Classic Cipolline 360 g,Carrefour,"6,62",CONDIMENTI_CONSERVE
Valfrutta Green Passata Biologica 700 g,Valfrutta,"2,99",CONDIMENTI_CONSERVE
Terre d'Italia Paté di olive Taggiasca 180 g,Terre d'Italia,"19,39",CONDIMENTI_CONSERVE
"Rio mare Insalatissime Insalata di Tonno Messicana con fagioli rossi, mais e peperoni 160 g",Rio mare,"15,59",CONDIMENTI_CONSERVE
Alberti Olive denocciolate di qualità taggiasca 170 g,Alberti,"31,47",CONDIMENTI_CONSERVE
Tigullio Gran Pesto alla Genovese Cremoso 190 g,Tigullio,"13,95",CONDIMENTI_CONSERVE
Dante ConDisano Condimento Aromatizzato alle ebre mediterranee 1 L,Dante,"4,99",CONDIMENTI_CONSERVE
Barilla Pesto Basilico e Limone Condimento e Sugo per Pasta 190g,Barilla,"10,47",CONDIMENTI_CONSERVE
Carrefour Farro cotto al Vapore 3 x 150 g,Carrefour,"4,50",CONDIMENTI_CONSERVE
Ponti Aceto di Vino 1 l,Ponti,"1,19",CONDIMENTI_CONSERVE
Valfrutta Bianchi di Spagna 3 x 400 g,Valfrutta,"4,33",CONDIMENTI_CONSERVE
Carrefour Classic Pomodori Pelati in Succo di Pomodoro 800 g,Carrefour,"2,48",CONDIMENTI_CONSERVE
Carrefour Sensation Salsa Barbecue 270 g,Carrefour,"6,48",CONDIMENTI_CONSERVE
Monini Selezione Italiana Bios Olio Extra Vergine di Oliva da Agricoltura Biologica 750 ml,Monini,"15,60",CONDIMENTI_CONSERVE
Bonduelle Borlotti al Vapore 3 x 165 g,Bonduelle,"6,64",CONDIMENTI_CONSERVE
Carrefour Classic Passata Rustica 690 g,Carrefour,"1,87",CONDIMENTI_CONSERVE
Carrefour Fagioli giganti Corona 3 x 400 g,Carrefour,"3,60",CONDIMENTI_CONSERVE
Carrefour Classic Cetriolini 700 g,Carrefour,"7,87",CONDIMENTI_CONSERVE
Simpl Olio di semi di Mais 1 L,Simpl,"2,19",CONDIMENTI_CONSERVE
Carrefour Bio Pomodorini 400 g,Carrefour Bio,"6,04",CONDIMENTI_CONSERVE
Carrefour Specialità Cipolle Borettane in Agrodolce 300 g,Carrefour,"11,71",CONDIMENTI_CONSERVE
Carrefour Bio Polpa di pomodoro in succo di pomodoro 690 g,Carrefour Bio,"2,59",CONDIMENTI_CONSERVE
Rio mare Filetto di Salmone all'Olio Extra Vergine di Oliva al Vapore 125 g,Rio mare,"50,80",CONDIMENTI_CONSERVE
Terre d'Italia Ragù con carne di cinghiale 200 g,Terre d'Italia,"23,95",CONDIMENTI_CONSERVE
Rio Mare Tonno all'Olio di Oliva 6 x 120 g,Rio Mare,"23,86",CONDIMENTI_CONSERVE
Carrefour Classic Salsa Tonnata 240 g,Carrefour,"6,76",CONDIMENTI_CONSERVE
Mutti Passata Siciliana 400 g,Mutti,"4,23",CONDIMENTI_CONSERVE
Biffi Che Sugo! Pesto Senza Aglio 140 g,Biffi,"21,36",CONDIMENTI_CONSERVE
Filippo Berio Classico Olio Extra Vergine di Oliva 1 L,Filippo Berio,"10,20",CONDIMENTI_CONSERVE
Ponti Zero Olio Pomodori Secchi 300 g,Ponti,"22,81",CONDIMENTI_CONSERVE
Carrefour Piselli cotti al Vapore 3 x150 g,Carrefour,"5,21",CONDIMENTI_CONSERVE
Tigullio Carciofi e Noci 185 g,Tigullio,"14,32",CONDIMENTI_CONSERVE
Star il mio Dado Classico 10 Dadi 100 g,Star,"14,50",CONDIMENTI_CONSERVE
Star il mio Gran Ragù con Speck 2 x 180 g,Star,"8,03",CONDIMENTI_CONSERVE
Carrefour Fagioli Cannellini cotti al Vapore 3 x 150 g,Carrefour,"4,50",CONDIMENTI_CONSERVE
Ponti Aceto di Vino Rosso 1 l,Ponti,"1,05",CONDIMENTI_CONSERVE
Carrefour Classic Passata di Pomodoro 2 x 230 g,Carrefour,"3,67",CONDIMENTI_CONSERVE
Delicius Cantabrico Filetti di Alici in olio di oliva 28 g,Delicius,"69,64",CONDIMENTI_CONSERVE
Rio mare Pesto al Tonno con Mandorle e Pecorino 130 g,Rio mare,"23,77",CONDIMENTI_CONSERVE
Polli Pesto Pomodori Secchi e Formaggio 2 x 90 g,Polli,"15,50",CONDIMENTI_CONSERVE
Monini Selezione Italiana GranFruttato Olio Extra Vergine di Oliva 100% Italiano 1 L,Monini,"13,10",CONDIMENTI_CONSERVE
Carrefour Olive Verdi Intere in salamoia 360 g,Carrefour,"8,52",CONDIMENTI_CONSERVE
Delicius Filetti di Sgombro Grigliato all'olio di oliva 110 g,Delicius,"29,00",CONDIMENTI_CONSERVE
Rio mare Filetti di Tonno Lavorati a Mano all'Olio di Oliva 130 g,Rio mare,"30,69",CONDIMENTI_CONSERVE
Mutti Passata Pugliese 400 g,Mutti,"4,23",CONDIMENTI_CONSERVE
Calvè Cheddar 240 ml,Calvé,"11,16",CONDIMENTI_CONSERVE
Polli Pesto alla Genovese 2 x 90 g,Polli,"19,39",CONDIMENTI_CONSERVE
Madama Oliva il Frutto d'Italia Lupini 480 g,Madama Oliva,"8,86",CONDIMENTI_CONSERVE
Knorr Dado Classico 20 Dadi 200 g,Knorr,"10,45",CONDIMENTI_CONSERVE
Carrefour Classic Insalatina 350 g,Carrefour,"8,28",CONDIMENTI_CONSERVE
"Mutti Sugo con Pomodoro Rossoro, Verdure Grigliate e con Cipolla Rossa di Tropea Calabria IGP 280 g",Mutti,"4,61",CONDIMENTI_CONSERVE
Costa d'Oro il Grezzo 100% Italiano Non Filtrato Olio Extra Vergine di Oliva1 L,Costa d'Oro,"12,80",CONDIMENTI_CONSERVE
"Carrefour Extra Cipolle Borettane in ""Aceto Balsamico di Modena IGP"" 300 g",Carrefour,"11,61",CONDIMENTI_CONSERVE
Asdomar Tonno trancio intero all'olio di oliva 2 x 100 g,Asdomar,"24,95",CONDIMENTI_CONSERVE
Carrefour Extra Verdure Miste Agrodolci 300 g,Carrefour,"9,39",CONDIMENTI_CONSERVE
Carrefour Classic Salsa al Basilico 350 g,Carrefour,"3,69",CONDIMENTI_CONSERVE
Carrefour Classic Ragù alla Bolognese 2 x 180 g,Carrefour,"5,97",CONDIMENTI_CONSERVE
Cirio i Classici dal 1856 Pelati 800 g,Cirio,"5,38",CONDIMENTI_CONSERVE
Heinz Salsa Burger 230 g,Heinz,"15,78",CONDIMENTI_CONSERVE
Simpl Piselli Molto fini 800 g,Simpl,"3,02",CONDIMENTI_CONSERVE
Carapelli Oro Verde Olio Extra Vergine di Oliva 100% Italiano 1 L,Carapelli,"12,20",CONDIMENTI_CONSERVE
Carrefour Extra Peperoni Agrodolci 300 g,Carrefour,"13,06",CONDIMENTI_CONSERVE
Carrefour Classic Ragù alla Salsiccia 2 x 180 g,Carrefour,"5,97",CONDIMENTI_CONSERVE
Calvé Raffinata 150 ml,Calvé,"13,00",CONDIMENTI_CONSERVE
Carrefour Classic Peperoni Filetti 350 g,Carrefour,"9,72",CONDIMENTI_CONSERVE
Carrefour Extra Olive Denocciolate Giganti 300 g,Carrefour,"16,58",CONDIMENTI_CONSERVE
"Carrefour Bio Pesto senz'aglio con ""Basilico Genovese DOP"" 100 g",Carrefour Bio,"26,90",CONDIMENTI_CONSERVE
Carrefour Specialità Funghi trifolati in olio di semi di girasole 180 g,Carrefour,"21,90",CONDIMENTI_CONSERVE
Carrefour Classic Giardiniera 360 g,Carrefour,"6,43",CONDIMENTI_CONSERVE
Carrefour Extra Peperoni Arrostiti 280 g,Carrefour,"9,25",CONDIMENTI_CONSERVE
Barilla Salsa Pronta Classica 100% ingredienti italiani 300g,Barilla,"5,30",CONDIMENTI_CONSERVE
Carrefour Bio Brodo granulare Vegetale biologico 120 g,Carrefour Bio,"23,75",CONDIMENTI_CONSERVE
Bonduelle Borlotti al Vapore 310 g,Bonduelle,"6,36",CONDIMENTI_CONSERVE
Ponti Aceto di Mele 500 ml,Ponti,"3,18",CONDIMENTI_CONSERVE
Carrefour Classic Salsa Tartara 240 g,Carrefour,"5,96",CONDIMENTI_CONSERVE
Saclà OlivOlì Verdi a Rondelle 185 g,Saclà,"9,29",CONDIMENTI_CONSERVE
Maya Olio di Semi di Mais Vitaminizzato 1 l,Maya,"3,29",CONDIMENTI_CONSERVE
Barilla Pesto Basilico e Pistacchio Condimento e Sugo per Pasta 190 g,Barilla,"10,47",CONDIMENTI_CONSERVE
Rio mare Tonno in salsa con Fagioli 2 x 160 g,Rio mare,"9,97",CONDIMENTI_CONSERVE
Carrefour Sugo alle Olive 350 g,Carrefour,"3,69",CONDIMENTI_CONSERVE
Biffi Che Sugo! Sugo ai Funghi Porcini 150 g,Biffi,"19,93",CONDIMENTI_CONSERVE
"Carapelli il Nobile Olio Extra Vergine di Oliva 100% Italiano 1,00 L",Carapelli,"12,20",CONDIMENTI_CONSERVE
Carrefour Classic Dado Classico 220 g,Carrefour,"6,59",CONDIMENTI_CONSERVE
Calvé Ketchup 430 ml,Calvé,"6,72",CONDIMENTI_CONSERVE
Pomì Pomodori a Cubetti 2 x 400 g,Pomì,"2,69",CONDIMENTI_CONSERVE
Simpl Olio di semi di Arachide 1 L,Simpl,"3,29",CONDIMENTI_CONSERVE
Monini Anfora Olio di Oliva 1 Litro,Monini,"9,89",CONDIMENTI_CONSERVE
Biffi Che Sugo! Pesto 100% Vegetale Senza Aglio 150 g,Biffi,"19,93",CONDIMENTI_CONSERVE
Giovanni Rana il Sugo Fresco Carciofi 180 g,Giovanni Rana,"17,72",CONDIMENTI_CONSERVE
Ariosto per Carni Arrosto e ai Ferri con Sale Iodato 80 g,Ariosto,"33,63",CONDIMENTI_CONSERVE
Palmera Tonno all'Olio di Oliva 3 x 80 g,Palmera,"15,21",CONDIMENTI_CONSERVE
Monini per la cucina Delicata Olio Extra Vergine di Oliva 750 ml,Monini,"11,80",CONDIMENTI_CONSERVE
Carrefour Classic Passata di Pomodorini 400 g,Carrefour,"2,48",CONDIMENTI_CONSERVE
Carrefour Classic Sugo alle Noci 140 g,Carrefour,"13,93",CONDIMENTI_CONSERVE
Mareblu Tonno all'Olio d'Oliva Non Si Sgocciola 8 x 60 g,Mareblu,"17,90",CONDIMENTI_CONSERVE
Barilla Sugo Ragù Montanaro con funghi Condimento per Pasta 400g,Barilla,"7,48",CONDIMENTI_CONSERVE
Carrefour Piselli stufati extra fini 330 g,Carrefour,"6,48",CONDIMENTI_CONSERVE
Alberti Paté di Olive di Qualità Taggiasca 170 g,Alberti,"23,47",CONDIMENTI_CONSERVE
Carrefour Extra Cipolle Borettane Arrostite 280 g,Carrefour,"17,59",CONDIMENTI_CONSERVE
Carrefour Extra Funghi Arrostiti 280 g,Carrefour,"13,89",CONDIMENTI_CONSERVE
Rio mare Filetti di Tonno Lavorati a Mano all'Olio di Oliva Lime e Zenzero 130 g,Rio mare,"30,69",CONDIMENTI_CONSERVE
MAGGI Dado Classico preparato per brodo (20 dadi) 200 g,MAGGI,"9,75",CONDIMENTI_CONSERVE
Carrefour Classic Olive Verdi Snocciolate 2 x 50 g,Carrefour,"10,90",CONDIMENTI_CONSERVE
Carrefour Tonno a pinne gialle all'olio di oliva 500 g,Carrefour,"13,18",CONDIMENTI_CONSERVE
Carrefour Classic Sugo ai Formaggi 180 g,Carrefour,"11,94",CONDIMENTI_CONSERVE
Develey Dressing Erbette 230 ml,Develey,"9,52",CONDIMENTI_CONSERVE
Knorr Aromat Insaporitore in Polvere 90 g,Knorr,"23,22",CONDIMENTI_CONSERVE
Biffi Che Sugo! Sugo Cacio e Pepe 150 g,Biffi,"23,93",CONDIMENTI_CONSERVE
Terre d'Italia Ragù con carne di razza Chianina 200 g,Terre d'Italia,"23,95",CONDIMENTI_CONSERVE
Calvè Senape 250 ml,Calvé,"10,36",CONDIMENTI_CONSERVE
Ortolina Classica Sugo di Pomodoro con Verdure 130 g,Ortolina,"8,38",CONDIMENTI_CONSERVE
Gemma di mare Gli Integrali Sale Rosa dell'Himalaya Grosso 1000 g,Gemma di mare,"3,69",CONDIMENTI_CONSERVE
Carrefour Classic Dado Vegetale 220 g,Carrefour,"6,59",CONDIMENTI_CONSERVE
Madama Oliva il Frutto d'Italia Olive Nocellara Etnea Verdi Denocciolate 200 g,Madama Oliva,"17,40",CONDIMENTI_CONSERVE
Rio mare Tonno in salsa con Piselli 2 x 160 g,Rio mare,"9,97",CONDIMENTI_CONSERVE
Terre d'Italia Pomodori secchi di Puglia sott'olio 235 g,Terre d'Italia,"21,23",CONDIMENTI_CONSERVE
Benvolio Olio di Cocco Vergine Biologico 200 ml,Benvolio,"21,25",CONDIMENTI_CONSERVE
Carrefour Extra Borettane in Aceto Rosso 700 g,Carrefour,"8,55",CONDIMENTI_CONSERVE
Valsoia Bontà e Salute Maionese senza uova con proteine vegetali 145 g,Valsoia Bontà e Salute,"17,93",CONDIMENTI_CONSERVE
Clemente Olio Extravergine di Oliva 100% Italiano Biologico 1 L,Clemente,"12,99",CONDIMENTI_CONSERVE
Star il mio Gran Ragù con Funghi Porcini 2 x 180 g,Star,"8,03",CONDIMENTI_CONSERVE
Buitoni Pesto Fresco alla Siciliana 130 g,Buitoni,"19,92",CONDIMENTI_CONSERVE
Carrefour Sottolio Funghi in olio di semi di girasole 280 g,Carrefour,"12,82",CONDIMENTI_CONSERVE
Carrefour Sottolio Funghi alla Paesana 280 g,Carrefour,"9,96",CONDIMENTI_CONSERVE
